{
  "schemaVersion": "0.2.0-proposed",
  "type": "GovernedContextPackManifest",
  "status": "proposed",
  "packId": "fictional-boreal-quebec-en",
  "intentToken": "representation-gap",
  "lang": "en",
  "version": "semantic-boundaries-1",
  "payloadUrl": "https://gautierdorval.com/semantic-boundaries/en.json",
  "payloadDigest": "sha-256:b034345773f1178d333d7de3de056b929c5c1680219ac9a3edf06c9e853f4839",
  "payloadDigestScope": "canonical-json",
  "payloadFileDigest": "sha-256:f23da03ec5c0e9a798539bca87ad33a55becd0a15b2b26118efd0f54d1bc7e59",
  "payloadFileDigestScope": "repository-bytes",
  "canonicalizationPolicyId": "gd-deterministic-json-v1",
  "fileEncoding": "utf-8",
  "fileLineEndings": "lf",
  "compositionPolicyId": "fictional-boreal-local-explanation-v1",
  "corpusVersion": "semantic-boundaries-1",
  "includedUnitIds": [
    "boreal-en-activationConditions",
    "boreal-en-nonApplicabilityConditions",
    "boreal-en-requiredEvidence",
    "boreal-en-forbiddenInferences",
    "boreal-en-applicabilityAbuseBoundaries",
    "boreal-en-weightingRules",
    "boreal-en-answerBoundaries"
  ],
  "includedArtifacts": [
    "/semantic-boundaries/content.json"
  ],
  "generatedBy": "build_governed_context_packs.py"
}
